[I 2021-06-29 14:12:06,134] Trial 41 finished with value: 0.5 and parameters: {'max_depth': 7, 'learning_rate': 0.0643879434627976, 'subsample': 0.5396383372068501, 'gamma': 0.840945141365163, 'n_estimators': 6513}. Best is trial 20 with value: 0.7000000000000001.
[I 2021-06-29 14:12:06,872] Trial 42 finished with value: 0.5714285714285715 and parameters: {'max_depth': 6, 'learning_rate': 0.09669362755966407, 'subsample': 0.2391645333443715, 'gamma': 0.20106361555170987, 'n_estimators': 1810}. Best is trial 20 with value: 0.7000000000000001.
[I 2021-06-29 14:12:07,767] Trial 43 finished with value: 0.7000000000000001 and parameters: {'max_depth': 8, 'learning_rate': 0.011937232474677819, 'subsample': 0.8583761689741448, 'gamma': 0.761692376936586, 'n_estimators': 1090}. Best is trial 20 with value: 0.7000000000000001.
[I 2021-06-29 14:12:08,903] Trial 44 finished with value: 0.5263157894736842 and parameters: {'max_depth': 4, 'learning_rate': 0.03988572169301533, 'subsample': 0.20479747584873353, 'gamma': 0.7475925537012656, 'n_estimators': 3068}. Best is trial 20 with value: 0.7000000000000001.
[I 2021-06-29 14:12:12,748] Trial 45 finished with value: 0.6666666666666666 and parameters: {'max_depth': 12, 'learning_rate': 0.062381276195237215, 'subsample': 0.8030655875294753, 'gamma': 0.7757875563137775, 'n_estimators': 6433}. Best is trial 20 with value: 0.7000000000000001.
[I 2021-06-29 14:12:14,681] Trial 46 finished with value: 0.6 and parameters: {'max_depth': 7, 'learning_rate': 0.059171213441833605, 'subsample': 0.7388828729216316, 'gamma': 0.32857508138731806, 'n_estimators': 3942}. Best is trial 20 with value: 0.7000000000000001.
[I 2021-06-29 14:12:17,508] Trial 47 finished with value: 0.6 and parameters: {'max_depth': 8, 'learning_rate': 0.011397994799575215, 'subsample': 0.5747851265573097, 'gamma': 0.44694107919156667, 'n_estimators': 5844}. Best is trial 20 with value: 0.7000000000000001.
[I 2021-06-29 14:12:19,698] Trial 48 finished with value: 0.5555555555555556 and parameters: {'max_depth': 6, 'learning_rate': 0.09035998376726362, 'subsample': 0.5622857722276284, 'gamma': 0.24720816130197207, 'n_estimators': 5728}. Best is trial 20 with value: 0.7000000000000001.
[I 2021-06-29 14:12:22,773] Trial 49 finished with value: 0.631578947368421 and parameters: {'max_depth': 9, 'learning_rate': 0.014851834486637766, 'subsample': 0.4361549440009058, 'gamma': 0.6432550692523437, 'n_estimators': 6512}. Best is trial 20 with value: 0.7000000000000001.
xgb_best_param_v1: {'max_depth': 6, 'learning_rate': 0.05743522920318484, 'subsample': 0.8087536794486196, 'gamma': 0.3858158080019999, 'n_estimators': 6452}
[I 2021-06-29 14:12:27,659] A new study created in memory with name: no-name-da20c7fa-ca81-4885-80e0-7d54f76974be
[LightGBM] [Warning] Unknown parameter: eval_metric
[I 2021-06-29 14:12:30,652] Trial 0 finished with value: 0.7000000000000001 and parameters: {'max_depth': 7, 'num_leaves': 44, 'learning_rate': 0.01001029373356104, 'n_estimators': 2814, 'colsample_bytree': 0.21740471265369044}. Best is trial 0 with value: 0.7000000000000001.
[LightGBM] [Warning] Unknown parameter: eval_metric
[I 2021-06-29 14:12:31,508] Trial 1 finished with value: 0.47058823529411764 and parameters: {'max_depth': 3, 'num_leaves': 13, 'learning_rate': 0.0411004654338743, 'n_estimators': 3381, 'colsample_bytree': 0.5310533872026856}. Best is trial 0 with value: 0.7000000000000001.
[LightGBM] [Warning] Unknown parameter: eval_metric
[I 2021-06-29 14:12:32,380] Trial 2 finished with value: 0.7999999999999999 and parameters: {'max_depth': 7, 'num_leaves': 42, 'learning_rate': 0.02840070247583657, 'n_estimators': 6269, 'colsample_bytree': 0.12191007455834094}. Best is trial 2 with value: 0.7999999999999999.
[LightGBM] [Warning] Unknown parameter: eval_metric
[I 2021-06-29 14:12:32,652] Trial 3 finished with value: 0.631578947368421 and parameters: {'max_depth': 9, 'num_leaves': 27, 'learning_rate': 0.06028208456011766, 'n_estimators': 1842, 'colsample_bytree': 0.25848119126790303}. Best is trial 2 with value: 0.7999999999999999.
[LightGBM] [Warning] Unknown parameter: eval_metric
[I 2021-06-29 14:12:33,288] Trial 4 finished with value: 0.5263157894736842 and parameters: {'max_depth': 11, 'num_leaves': 59, 'learning_rate': 0.03820817603433186, 'n_estimators': 5154, 'colsample_bytree': 0.8011113218368306}. Best is trial 2 with value: 0.7999999999999999.
[LightGBM] [Warning] Unknown parameter: eval_metric
[I 2021-06-29 14:12:33,695] Trial 5 finished with value: 0.5555555555555556 and parameters: {'max_depth': 11, 'num_leaves': 7, 'learning_rate': 0.013514930490959413, 'n_estimators': 2019, 'colsample_bytree': 0.8025140027435306}. Best is trial 2 with value: 0.7999999999999999.
[LightGBM] [Warning] Unknown parameter: eval_metric
[I 2021-06-29 14:12:34,262] Trial 6 finished with value: 0.4444444444444444 and parameters: {'max_depth': 3, 'num_leaves': 27, 'learning_rate': 0.09621005771354518, 'n_estimators': 4199, 'colsample_bytree': 0.6535016911603787}. Best is trial 2 with value: 0.7999999999999999.
[LightGBM] [Warning] Unknown parameter: eval_metric
[I 2021-06-29 14:12:34,494] Trial 7 finished with value: 0.5263157894736842 and parameters: {'max_depth': 6, 'num_leaves': 42, 'learning_rate': 0.08511631047076357, 'n_estimators': 1109, 'colsample_bytree': 0.700115451955974}. Best is trial 2 with value: 0.7999999999999999.
[LightGBM] [Warning] Unknown parameter: eval_metric
[I 2021-06-29 14:12:35,324] Trial 8 finished with value: 0.7368421052631577 and parameters: {'max_depth': 12, 'num_leaves': 46, 'learning_rate': 0.03523995928579647, 'n_estimators': 5736, 'colsample_bytree': 0.18258080526211362}. Best is trial 2 with value: 0.7999999999999999.
[LightGBM] [Warning] Unknown parameter: eval_metric
[I 2021-06-29 14:12:35,730] Trial 9 finished with value: 0.6666666666666666 and parameters: {'max_depth': 7, 'num_leaves': 55, 'learning_rate': 0.03642527335363116, 'n_estimators': 2726, 'colsample_bytree': 0.20402285769462214}. Best is trial 2 with value: 0.7999999999999999.
[LightGBM] [Warning] Unknown parameter: eval_metric
[I 2021-06-29 14:12:36,077] Trial 10 finished with value: 0.5555555555555556 and parameters: {'max_depth': 3, 'num_leaves': 42, 'learning_rate': 0.029046530440005318, 'n_estimators': 2593, 'colsample_bytree': 0.4932585274242707}. Best is trial 2 with value: 0.7999999999999999.
[LightGBM] [Warning] Unknown parameter: eval_metric
[I 2021-06-29 14:12:36,656] Trial 11 finished with value: 0.631578947368421 and parameters: {'max_depth': 3, 'num_leaves': 36, 'learning_rate': 0.023205571741522914, 'n_estimators': 4536, 'colsample_bytree': 0.6598066880167449}. Best is trial 2 with value: 0.7999999999999999.
[LightGBM] [Warning] Unknown parameter: eval_metric
[I 2021-06-29 14:12:37,086] Trial 12 finished with value: 0.6666666666666666 and parameters: {'max_depth': 4, 'num_leaves': 27, 'learning_rate': 0.07249601419549706, 'n_estimators': 3485, 'colsample_bytree': 0.13996276715686973}. Best is trial 2 with value: 0.7999999999999999.
[LightGBM] [Warning] Unknown parameter: eval_metric
[I 2021-06-29 14:12:37,898] Trial 13 finished with value: 0.5555555555555556 and parameters: {'max_depth': 8, 'num_leaves': 41, 'learning_rate': 0.05634002008524778, 'n_estimators': 6668, 'colsample_bytree': 0.5692440324015944}. Best is trial 2 with value: 0.7999999999999999.
[LightGBM] [Warning] Unknown parameter: eval_metric
[I 2021-06-29 14:12:38,723] Trial 14 finished with value: 0.5263157894736842 and parameters: {'max_depth': 12, 'num_leaves': 10, 'learning_rate': 0.02253487125256827, 'n_estimators': 5845, 'colsample_bytree': 0.4181414695884269}. Best is trial 2 with value: 0.7999999999999999.
[LightGBM] [Warning] Unknown parameter: eval_metric
[I 2021-06-29 14:12:39,490] Trial 15 finished with value: 0.4444444444444444 and parameters: {'max_depth': 4, 'num_leaves': 56, 'learning_rate': 0.0412989273770956, 'n_estimators': 5505, 'colsample_bytree': 0.6807983882803612}. Best is trial 2 with value: 0.7999999999999999.
[LightGBM] [Warning] Unknown parameter: eval_metric
[I 2021-06-29 14:12:39,999] Trial 16 finished with value: 0.5882352941176471 and parameters: {'max_depth': 11, 'num_leaves': 39, 'learning_rate': 0.07758481906246036, 'n_estimators': 3093, 'colsample_bytree': 0.31594231341202084}. Best is trial 2 with value: 0.7999999999999999.
[LightGBM] [Warning] Unknown parameter: eval_metric
[I 2021-06-29 14:12:40,555] Trial 17 finished with value: 0.4444444444444444 and parameters: {'max_depth': 11, 'num_leaves': 27, 'learning_rate': 0.0968356042433547, 'n_estimators': 4981, 'colsample_bytree': 0.5973565761672974}. Best is trial 2 with value: 0.7999999999999999.
[LightGBM] [Warning] Unknown parameter: eval_metric
[I 2021-06-29 14:12:41,162] Trial 18 finished with value: 0.5 and parameters: {'max_depth': 4, 'num_leaves': 58, 'learning_rate': 0.050492092013194656, 'n_estimators': 4470, 'colsample_bytree': 0.426509442209025}. Best is trial 2 with value: 0.7999999999999999.
[LightGBM] [Warning] Unknown parameter: eval_metric
[I 2021-06-29 14:12:41,369] Trial 19 finished with value: 0.5555555555555556 and parameters: {'max_depth': 5, 'num_leaves': 55, 'learning_rate': 0.06163115380050573, 'n_estimators': 1017, 'colsample_bytree': 0.5937159308965791}. Best is trial 2 with value: 0.7999999999999999.
[LightGBM] [Warning] Unknown parameter: eval_metric
[I 2021-06-29 14:12:41,931] Trial 20 finished with value: 0.5263157894736842 and parameters: {'max_depth': 6, 'num_leaves': 33, 'learning_rate': 0.08973478893796971, 'n_estimators': 3143, 'colsample_bytree': 0.8268281207358393}. Best is trial 2 with value: 0.7999999999999999.
[LightGBM] [Warning] Unknown parameter: eval_metric
[I 2021-06-29 14:12:42,519] Trial 21 finished with value: 0.4210526315789474 and parameters: {'max_depth': 9, 'num_leaves': 3, 'learning_rate': 0.09364935103693853, 'n_estimators': 5146, 'colsample_bytree': 0.8978582803611844}. Best is trial 2 with value: 0.7999999999999999.
[LightGBM] [Warning] Unknown parameter: eval_metric
[I 2021-06-29 14:12:43,196] Trial 22 finished with value: 0.631578947368421 and parameters: {'max_depth': 4, 'num_leaves': 10, 'learning_rate': 0.09393359167334472, 'n_estimators': 5181, 'colsample_bytree': 0.15280013817765}. Best is trial 2 with value: 0.7999999999999999.
[LightGBM] [Warning] Unknown parameter: eval_metric
[I 2021-06-29 14:12:43,945] Trial 23 finished with value: 0.7000000000000001 and parameters: {'max_depth': 10, 'num_leaves': 46, 'learning_rate': 0.0930722081991835, 'n_estimators': 5269, 'colsample_bytree': 0.19941676957773177}. Best is trial 2 with value: 0.7999999999999999.
[LightGBM] [Warning] Unknown parameter: eval_metric
[I 2021-06-29 14:12:44,299] Trial 24 finished with value: 0.6 and parameters: {'max_depth': 3, 'num_leaves': 4, 'learning_rate': 0.012547583921871514, 'n_estimators': 2477, 'colsample_bytree': 0.7880223589463105}. Best is trial 2 with value: 0.7999999999999999.
[LightGBM] [Warning] Unknown parameter: eval_metric
[I 2021-06-29 14:12:44,597] Trial 25 finished with value: 0.5555555555555556 and parameters: {'max_depth': 8, 'num_leaves': 35, 'learning_rate': 0.08578278031236451, 'n_estimators': 1745, 'colsample_bytree': 0.3233469432089116}. Best is trial 2 with value: 0.7999999999999999.
[LightGBM] [Warning] Unknown parameter: eval_metric
[I 2021-06-29 14:12:44,965] Trial 26 finished with value: 0.5263157894736842 and parameters: {'max_depth': 8, 'num_leaves': 59, 'learning_rate': 0.0604927197330139, 'n_estimators': 1111, 'colsample_bytree': 0.7405061381444931}. Best is trial 2 with value: 0.7999999999999999.
[LightGBM] [Warning] Unknown parameter: eval_metric
[I 2021-06-29 14:12:45,759] Trial 27 finished with value: 0.5263157894736842 and parameters: {'max_depth': 5, 'num_leaves': 49, 'learning_rate': 0.044907457965775464, 'n_estimators': 6182, 'colsample_bytree': 0.6976973141897477}. Best is trial 2 with value: 0.7999999999999999.
[LightGBM] [Warning] Unknown parameter: eval_metric
[I 2021-06-29 14:12:46,055] Trial 28 finished with value: 0.7000000000000001 and parameters: {'max_depth': 8, 'num_leaves': 10, 'learning_rate': 0.015392592056099049, 'n_estimators': 1728, 'colsample_bytree': 0.1356415028358094}. Best is trial 2 with value: 0.7999999999999999.
[LightGBM] [Warning] Unknown parameter: eval_metric
[I 2021-06-29 14:12:46,835] Trial 29 finished with value: 0.7368421052631577 and parameters: {'max_depth': 4, 'num_leaves': 16, 'learning_rate': 0.0741690082344409, 'n_estimators': 4358, 'colsample_bytree': 0.11004478412729268}. Best is trial 2 with value: 0.7999999999999999.
[LightGBM] [Warning] Unknown parameter: eval_metric
[I 2021-06-29 14:12:47,236] Trial 30 finished with value: 0.5555555555555556 and parameters: {'max_depth': 3, 'num_leaves': 59, 'learning_rate': 0.0611290415727948, 'n_estimators': 2219, 'colsample_bytree': 0.3018605956562588}. Best is trial 2 with value: 0.7999999999999999.
[LightGBM] [Warning] Unknown parameter: eval_metric
[I 2021-06-29 14:12:47,970] Trial 31 finished with value: 0.5555555555555556 and parameters: {'max_depth': 10, 'num_leaves': 14, 'learning_rate': 0.062322303454593206, 'n_estimators': 6821, 'colsample_bytree': 0.7774630411920282}. Best is trial 2 with value: 0.7999999999999999.
[LightGBM] [Warning] Unknown parameter: eval_metric
[I 2021-06-29 14:12:48,751] Trial 32 finished with value: 0.7368421052631577 and parameters: {'max_depth': 5, 'num_leaves': 31, 'learning_rate': 0.06579601465432418, 'n_estimators': 5974, 'colsample_bytree': 0.22543311571686742}. Best is trial 2 with value: 0.7999999999999999.
[LightGBM] [Warning] Unknown parameter: eval_metric
[I 2021-06-29 14:12:49,241] Trial 33 finished with value: 0.47058823529411764 and parameters: {'max_depth': 3, 'num_leaves': 7, 'learning_rate': 0.05377105998433287, 'n_estimators': 4638, 'colsample_bytree': 0.5550811496691851}. Best is trial 2 with value: 0.7999999999999999.
[LightGBM] [Warning] Unknown parameter: eval_metric
[I 2021-06-29 14:12:49,732] Trial 34 finished with value: 0.5263157894736842 and parameters: {'max_depth': 6, 'num_leaves': 60, 'learning_rate': 0.06217706973212173, 'n_estimators': 3281, 'colsample_bytree': 0.5407585752943175}. Best is trial 2 with value: 0.7999999999999999.
[LightGBM] [Warning] Unknown parameter: eval_metric
[I 2021-06-29 14:12:49,925] Trial 35 finished with value: 0.631578947368421 and parameters: {'max_depth': 10, 'num_leaves': 41, 'learning_rate': 0.03384276018965285, 'n_estimators': 1398, 'colsample_bytree': 0.39606735833128504}. Best is trial 2 with value: 0.7999999999999999.
[LightGBM] [Warning] Unknown parameter: eval_metric
[I 2021-06-29 14:12:50,167] Trial 36 finished with value: 0.6666666666666666 and parameters: {'max_depth': 9, 'num_leaves': 15, 'learning_rate': 0.07774799983649325, 'n_estimators': 1399, 'colsample_bytree': 0.3082520788628328}. Best is trial 2 with value: 0.7999999999999999.
[LightGBM] [Warning] Unknown parameter: eval_metric
[I 2021-06-29 14:12:50,614] Trial 37 finished with value: 0.5 and parameters: {'max_depth': 11, 'num_leaves': 14, 'learning_rate': 0.06755147927919462, 'n_estimators': 4148, 'colsample_bytree': 0.8398463763194806}. Best is trial 2 with value: 0.7999999999999999.
[LightGBM] [Warning] Unknown parameter: eval_metric
[I 2021-06-29 14:12:51,178] Trial 38 finished with value: 0.4210526315789474 and parameters: {'max_depth': 5, 'num_leaves': 6, 'learning_rate': 0.07615593669598025, 'n_estimators': 5633, 'colsample_bytree': 0.8262526820028192}. Best is trial 2 with value: 0.7999999999999999.
[LightGBM] [Warning] Unknown parameter: eval_metric
[I 2021-06-29 14:12:51,608] Trial 39 finished with value: 0.5714285714285715 and parameters: {'max_depth': 12, 'num_leaves': 3, 'learning_rate': 0.031092587750927846, 'n_estimators': 4701, 'colsample_bytree': 0.8592130565500932}. Best is trial 2 with value: 0.7999999999999999.
[LightGBM] [Warning] Unknown parameter: eval_metric
[I 2021-06-29 14:12:52,085] Trial 40 finished with value: 0.631578947368421 and parameters: {'max_depth': 12, 'num_leaves': 35, 'learning_rate': 0.0924045714789647, 'n_estimators': 4850, 'colsample_bytree': 0.412006171312997}. Best is trial 2 with value: 0.7999999999999999.
[LightGBM] [Warning] Unknown parameter: eval_metric
[I 2021-06-29 14:12:52,779] Trial 41 finished with value: 0.5555555555555556 and parameters: {'max_depth': 7, 'num_leaves': 38, 'learning_rate': 0.05945931293577064, 'n_estimators': 6558, 'colsample_bytree': 0.8349867485068849}. Best is trial 2 with value: 0.7999999999999999.
[LightGBM] [Warning] Unknown parameter: eval_metric
[I 2021-06-29 14:12:53,053] Trial 42 finished with value: 0.6666666666666666 and parameters: {'max_depth': 6, 'num_leaves': 58, 'learning_rate': 0.02565601000124179, 'n_estimators': 1758, 'colsample_bytree': 0.20806332643738507}. Best is trial 2 with value: 0.7999999999999999.
[LightGBM] [Warning] Unknown parameter: eval_metric
[I 2021-06-29 14:12:53,650] Trial 43 finished with value: 0.7368421052631577 and parameters: {'max_depth': 8, 'num_leaves': 4, 'learning_rate': 0.0953173190095913, 'n_estimators': 5963, 'colsample_bytree': 0.11201518459369791}. Best is trial 2 with value: 0.7999999999999999.
[LightGBM] [Warning] Unknown parameter: eval_metric
[I 2021-06-29 14:12:54,423] Trial 44 finished with value: 0.5 and parameters: {'max_depth': 4, 'num_leaves': 22, 'learning_rate': 0.02178971603298252, 'n_estimators': 5857, 'colsample_bytree': 0.37578932214663474}. Best is trial 2 with value: 0.7999999999999999.
[LightGBM] [Warning] Unknown parameter: eval_metric
[I 2021-06-29 14:12:55,100] Trial 45 finished with value: 0.5 and parameters: {'max_depth': 12, 'num_leaves': 36, 'learning_rate': 0.08909487859706597, 'n_estimators': 6069, 'colsample_bytree': 0.8243138549669194}. Best is trial 2 with value: 0.7999999999999999.
[LightGBM] [Warning] Unknown parameter: eval_metric
[I 2021-06-29 14:12:55,424] Trial 46 finished with value: 0.631578947368421 and parameters: {'max_depth': 7, 'num_leaves': 34, 'learning_rate': 0.08187432320368354, 'n_estimators': 2714, 'colsample_bytree': 0.49220281809594224}. Best is trial 2 with value: 0.7999999999999999.
[LightGBM] [Warning] Unknown parameter: eval_metric
[I 2021-06-29 14:12:55,749] Trial 47 finished with value: 0.5714285714285715 and parameters: {'max_depth': 8, 'num_leaves': 3, 'learning_rate': 0.06341332673769735, 'n_estimators': 3602, 'colsample_bytree': 0.7458884231078732}. Best is trial 2 with value: 0.7999999999999999.
[LightGBM] [Warning] Unknown parameter: eval_metric
[I 2021-06-29 14:12:56,108] Trial 48 finished with value: 0.5263157894736842 and parameters: {'max_depth': 6, 'num_leaves': 54, 'learning_rate': 0.0620071493756082, 'n_estimators': 2104, 'colsample_bytree': 0.7303433870604035}. Best is trial 2 with value: 0.7999999999999999.
[LightGBM] [Warning] Unknown parameter: eval_metric
[I 2021-06-29 14:12:56,708] Trial 49 finished with value: 0.39999999999999997 and parameters: {'max_depth': 9, 'num_leaves': 6, 'learning_rate': 0.04781743120010191, 'n_estimators': 5075, 'colsample_bytree': 0.8348814223820207}. Best is trial 2 with value: 0.7999999999999999.
lgbm_best_param_v1: {'max_depth': 7, 'num_leaves': 42, 'learning_rate': 0.02840070247583657, 'n_estimators': 6269, 'colsample_bytree': 0.12191007455834094}

[I 2021-07-01 18:34:26,495] A new study created in memory with name: no-name-4efe5537-7fb4-4b05-b04d-639bb7f12d55
[I 2021-07-01 18:34:26,512] Trial 0 finished with value: 0.0 and parameters: {'C': 0.0012164941464151843, 'gamma': 0.0399597228313506, 'kernel': 'rbf'}. Best is trial 0 with value: 0.0.
[I 2021-07-01 18:34:26,526] Trial 1 finished with value: 0.0 and parameters: {'C': 2.8952960233492834e-05, 'gamma': 8.536916958038759e-05, 'kernel': 'sigmoid'}. Best is trial 0 with value: 0.0.
[I 2021-07-01 18:34:26,541] Trial 2 finished with value: 0.0 and parameters: {'C': 0.0012473047378928962, 'gamma': 0.026674574591455752, 'kernel': 'rbf'}. Best is trial 0 with value: 0.0.
[I 2021-07-01 18:34:26,736] Trial 3 finished with value: 0.6666666666666666 and parameters: {'C': 0.02250803339759749, 'gamma': 0.0012204612973233803, 'kernel': 'linear'}. Best is trial 3 with value: 0.6666666666666666.
[I 2021-07-01 18:34:26,751] Trial 4 finished with value: 0.0 and parameters: {'C': 0.10086090098685985, 'gamma': 0.6939175614145937, 'kernel': 'sigmoid'}. Best is trial 3 with value: 0.6666666666666666.
[I 2021-07-01 18:34:26,765] Trial 5 finished with value: 0.0 and parameters: {'C': 0.2971894016071674, 'gamma': 2.6620797194541587e-05, 'kernel': 'sigmoid'}. Best is trial 3 with value: 0.6666666666666666.
[I 2021-07-01 18:34:26,777] Trial 6 finished with value: 0.3636363636363636 and parameters: {'C': 3.1026598745141294e-05, 'gamma': 0.0012750820295281795, 'kernel': 'linear'}. Best is trial 3 with value: 0.6666666666666666.
[I 2021-07-01 18:34:26,793] Trial 7 finished with value: 0.5 and parameters: {'C': 0.00037807516906122445, 'gamma': 0.02707102116508004, 'kernel': 'linear'}. Best is trial 3 with value: 0.6666666666666666.
[I 2021-07-01 18:34:26,809] Trial 8 finished with value: 0.0 and parameters: {'C': 0.8796409613934173, 'gamma': 0.05505899398718485, 'kernel': 'rbf'}. Best is trial 3 with value: 0.6666666666666666.
[I 2021-07-01 18:34:26,838] Trial 9 finished with value: 0.6666666666666666 and parameters: {'C': 0.0017356718938171996, 'gamma': 0.34912224006065407, 'kernel': 'linear'}. Best is trial 3 with value: 0.6666666666666666.
[I 2021-07-01 18:34:26,849] Trial 10 finished with value: 0.0 and parameters: {'C': 1.2497835076619116e-05, 'gamma': 0.02478435748817647, 'kernel': 'sigmoid'}. Best is trial 3 with value: 0.6666666666666666.
[I 2021-07-01 18:34:26,859] Trial 11 finished with value: 0.0 and parameters: {'C': 1.848471358009251e-05, 'gamma': 0.007423146427788864, 'kernel': 'sigmoid'}. Best is trial 3 with value: 0.6666666666666666.
