[I 2021-06-29 14:09:36,328] A new study created in memory with name: no-name-28c1cb17-1d40-4d07-8fbd-2ad790bbe67b
[I 2021-06-29 14:09:36,537] Trial 0 finished with value: 0.5882352941176471 and parameters: {'max_depth': 8, 'min_samples_leaf': 4, 'max_features': 2}. Best is trial 0 with value: 0.5882352941176471.
[I 2021-06-29 14:09:36,701] Trial 1 finished with value: 0.7368421052631577 and parameters: {'max_depth': 6, 'min_samples_leaf': 2, 'max_features': 3}. Best is trial 1 with value: 0.7368421052631577.
[I 2021-06-29 14:09:36,860] Trial 2 finished with value: 0.7368421052631577 and parameters: {'max_depth': 4, 'min_samples_leaf': 3, 'max_features': 9}. Best is trial 1 with value: 0.7368421052631577.
[I 2021-06-29 14:09:37,060] Trial 3 finished with value: 0.631578947368421 and parameters: {'max_depth': 10, 'min_samples_leaf': 3, 'max_features': 14}. Best is trial 1 with value: 0.7368421052631577.
[I 2021-06-29 14:09:37,278] Trial 4 finished with value: 0.6666666666666666 and parameters: {'max_depth': 5, 'min_samples_leaf': 4, 'max_features': 2}. Best is trial 1 with value: 0.7368421052631577.
[I 2021-06-29 14:09:37,468] Trial 5 finished with value: 0.6666666666666666 and parameters: {'max_depth': 12, 'min_samples_leaf': 3, 'max_features': 12}. Best is trial 1 with value: 0.7368421052631577.
[I 2021-06-29 14:09:37,640] Trial 6 finished with value: 0.7368421052631577 and parameters: {'max_depth': 4, 'min_samples_leaf': 2, 'max_features': 16}. Best is trial 1 with value: 0.7368421052631577.
[I 2021-06-29 14:09:37,832] Trial 7 finished with value: 0.631578947368421 and parameters: {'max_depth': 16, 'min_samples_leaf': 2, 'max_features': 14}. Best is trial 1 with value: 0.7368421052631577.
[I 2021-06-29 14:09:37,978] Trial 8 finished with value: 0.7000000000000001 and parameters: {'max_depth': 15, 'min_samples_leaf': 4, 'max_features': 3}. Best is trial 1 with value: 0.7368421052631577.
[I 2021-06-29 14:09:38,142] Trial 9 finished with value: 0.5555555555555556 and parameters: {'max_depth': 2, 'min_samples_leaf': 2, 'max_features': 17}. Best is trial 1 with value: 0.7368421052631577.
[I 2021-06-29 14:09:38,319] Trial 10 finished with value: 0.6666666666666666 and parameters: {'max_depth': 3, 'min_samples_leaf': 3, 'max_features': 19}. Best is trial 1 with value: 0.7368421052631577.
[I 2021-06-29 14:09:38,517] Trial 11 finished with value: 0.6666666666666666 and parameters: {'max_depth': 9, 'min_samples_leaf': 4, 'max_features': 7}. Best is trial 1 with value: 0.7368421052631577.
[I 2021-06-29 14:09:38,666] Trial 12 finished with value: 0.6666666666666666 and parameters: {'max_depth': 12, 'min_samples_leaf': 4, 'max_features': 2}. Best is trial 1 with value: 0.7368421052631577.
[I 2021-06-29 14:09:38,856] Trial 13 finished with value: 0.6666666666666666 and parameters: {'max_depth': 13, 'min_samples_leaf': 4, 'max_features': 15}. Best is trial 1 with value: 0.7368421052631577.
[I 2021-06-29 14:09:38,997] Trial 14 finished with value: 0.7000000000000001 and parameters: {'max_depth': 6, 'min_samples_leaf': 4, 'max_features': 3}. Best is trial 1 with value: 0.7368421052631577.
[I 2021-06-29 14:09:39,197] Trial 15 finished with value: 0.6666666666666666 and parameters: {'max_depth': 8, 'min_samples_leaf': 4, 'max_features': 7}. Best is trial 1 with value: 0.7368421052631577.
[I 2021-06-29 14:09:39,375] Trial 16 finished with value: 0.631578947368421 and parameters: {'max_depth': 6, 'min_samples_leaf': 2, 'max_features': 2}. Best is trial 1 with value: 0.7368421052631577.
[I 2021-06-29 14:09:39,551] Trial 17 finished with value: 0.6666666666666666 and parameters: {'max_depth': 12, 'min_samples_leaf': 2, 'max_features': 6}. Best is trial 1 with value: 0.7368421052631577.
[I 2021-06-29 14:09:39,763] Trial 18 finished with value: 0.6 and parameters: {'max_depth': 9, 'min_samples_leaf': 2, 'max_features': 12}. Best is trial 1 with value: 0.7368421052631577.
[I 2021-06-29 14:09:39,942] Trial 19 finished with value: 0.6666666666666666 and parameters: {'max_depth': 4, 'min_samples_leaf': 3, 'max_features': 14}. Best is trial 1 with value: 0.7368421052631577.
[I 2021-06-29 14:09:40,117] Trial 20 finished with value: 0.7000000000000001 and parameters: {'max_depth': 3, 'min_samples_leaf': 3, 'max_features': 14}. Best is trial 1 with value: 0.7368421052631577.
[I 2021-06-29 14:09:40,298] Trial 21 finished with value: 0.7000000000000001 and parameters: {'max_depth': 8, 'min_samples_leaf': 2, 'max_features': 11}. Best is trial 1 with value: 0.7368421052631577.
[I 2021-06-29 14:09:40,522] Trial 22 finished with value: 0.6363636363636364 and parameters: {'max_depth': 11, 'min_samples_leaf': 3, 'max_features': 19}. Best is trial 1 with value: 0.7368421052631577.
[I 2021-06-29 14:09:40,762] Trial 23 finished with value: 0.6666666666666666 and parameters: {'max_depth': 10, 'min_samples_leaf': 4, 'max_features': 4}. Best is trial 1 with value: 0.7368421052631577.
[I 2021-06-29 14:09:40,940] Trial 24 finished with value: 0.7000000000000001 and parameters: {'max_depth': 4, 'min_samples_leaf': 4, 'max_features': 9}. Best is trial 1 with value: 0.7368421052631577.
[I 2021-06-29 14:09:41,118] Trial 25 finished with value: 0.7368421052631577 and parameters: {'max_depth': 4, 'min_samples_leaf': 4, 'max_features': 8}. Best is trial 1 with value: 0.7368421052631577.
[I 2021-06-29 14:09:41,319] Trial 26 finished with value: 0.6363636363636364 and parameters: {'max_depth': 13, 'min_samples_leaf': 4, 'max_features': 17}. Best is trial 1 with value: 0.7368421052631577.
[I 2021-06-29 14:09:41,533] Trial 27 finished with value: 0.7000000000000001 and parameters: {'max_depth': 11, 'min_samples_leaf': 4, 'max_features': 8}. Best is trial 1 with value: 0.7368421052631577.
[I 2021-06-29 14:09:41,717] Trial 28 finished with value: 0.7000000000000001 and parameters: {'max_depth': 6, 'min_samples_leaf': 4, 'max_features': 9}. Best is trial 1 with value: 0.7368421052631577.
[I 2021-06-29 14:09:41,934] Trial 29 finished with value: 0.7000000000000001 and parameters: {'max_depth': 16, 'min_samples_leaf': 3, 'max_features': 13}. Best is trial 1 with value: 0.7368421052631577.
[I 2021-06-29 14:09:42,117] Trial 30 finished with value: 0.6 and parameters: {'max_depth': 3, 'min_samples_leaf': 4, 'max_features': 10}. Best is trial 1 with value: 0.7368421052631577.
[I 2021-06-29 14:09:42,362] Trial 31 finished with value: 0.7368421052631577 and parameters: {'max_depth': 10, 'min_samples_leaf': 3, 'max_features': 6}. Best is trial 1 with value: 0.7368421052631577.
[I 2021-06-29 14:09:42,573] Trial 32 finished with value: 0.5882352941176471 and parameters: {'max_depth': 15, 'min_samples_leaf': 3, 'max_features': 2}. Best is trial 1 with value: 0.7368421052631577.
[I 2021-06-29 14:09:42,756] Trial 33 finished with value: 0.6363636363636364 and parameters: {'max_depth': 11, 'min_samples_leaf': 2, 'max_features': 11}. Best is trial 1 with value: 0.7368421052631577.
[I 2021-06-29 14:09:43,118] Trial 34 finished with value: 0.6666666666666666 and parameters: {'max_depth': 15, 'min_samples_leaf': 3, 'max_features': 18}. Best is trial 1 with value: 0.7368421052631577.
[I 2021-06-29 14:09:43,337] Trial 35 finished with value: 0.6 and parameters: {'max_depth': 11, 'min_samples_leaf': 2, 'max_features': 18}. Best is trial 1 with value: 0.7368421052631577.
[I 2021-06-29 14:09:43,489] Trial 36 finished with value: 0.7000000000000001 and parameters: {'max_depth': 12, 'min_samples_leaf': 4, 'max_features': 5}. Best is trial 1 with value: 0.7368421052631577.
[I 2021-06-29 14:09:43,675] Trial 37 finished with value: 0.6666666666666666 and parameters: {'max_depth': 4, 'min_samples_leaf': 4, 'max_features': 14}. Best is trial 1 with value: 0.7368421052631577.
[I 2021-06-29 14:09:43,832] Trial 38 finished with value: 0.631578947368421 and parameters: {'max_depth': 2, 'min_samples_leaf': 4, 'max_features': 15}. Best is trial 1 with value: 0.7368421052631577.
[I 2021-06-29 14:09:43,984] Trial 39 finished with value: 0.6666666666666666 and parameters: {'max_depth': 15, 'min_samples_leaf': 4, 'max_features': 4}. Best is trial 1 with value: 0.7368421052631577.
[I 2021-06-29 14:09:44,129] Trial 40 finished with value: 0.7142857142857143 and parameters: {'max_depth': 2, 'min_samples_leaf': 2, 'max_features': 2}. Best is trial 1 with value: 0.7368421052631577.
[I 2021-06-29 14:09:44,302] Trial 41 finished with value: 0.7000000000000001 and parameters: {'max_depth': 5, 'min_samples_leaf': 4, 'max_features': 11}. Best is trial 1 with value: 0.7368421052631577.
[I 2021-06-29 14:09:44,574] Trial 42 finished with value: 0.6666666666666666 and parameters: {'max_depth': 10, 'min_samples_leaf': 4, 'max_features': 4}. Best is trial 1 with value: 0.7368421052631577.
[I 2021-06-29 14:09:44,826] Trial 43 finished with value: 0.6666666666666666 and parameters: {'max_depth': 6, 'min_samples_leaf': 3, 'max_features': 19}. Best is trial 1 with value: 0.7368421052631577.
[I 2021-06-29 14:09:45,041] Trial 44 finished with value: 0.6666666666666666 and parameters: {'max_depth': 10, 'min_samples_leaf': 2, 'max_features': 16}. Best is trial 1 with value: 0.7368421052631577.
[I 2021-06-29 14:09:45,199] Trial 45 finished with value: 0.6666666666666666 and parameters: {'max_depth': 5, 'min_samples_leaf': 4, 'max_features': 8}. Best is trial 1 with value: 0.7368421052631577.
[I 2021-06-29 14:09:45,377] Trial 46 finished with value: 0.6666666666666666 and parameters: {'max_depth': 14, 'min_samples_leaf': 4, 'max_features': 12}. Best is trial 1 with value: 0.7368421052631577.
[I 2021-06-29 14:09:45,522] Trial 47 finished with value: 0.7777777777777778 and parameters: {'max_depth': 4, 'min_samples_leaf': 2, 'max_features': 4}. Best is trial 47 with value: 0.7777777777777778.
[I 2021-06-29 14:09:45,667] Trial 48 finished with value: 0.75 and parameters: {'max_depth': 2, 'min_samples_leaf': 2, 'max_features': 6}. Best is trial 47 with value: 0.7777777777777778.
[I 2021-06-29 14:09:45,815] Trial 49 finished with value: 0.5882352941176471 and parameters: {'max_depth': 12, 'min_samples_leaf': 3, 'max_features': 2}. Best is trial 47 with value: 0.7777777777777778.
rf_best_param_v1: {'max_depth': 4, 'min_samples_leaf': 2, 'max_features': 4}
[I 2021-06-29 14:09:49,777] A new study created in memory with name: no-name-e4fc6ccf-8d0f-4e5f-af72-be74e0fbaa03
[I 2021-06-29 14:09:50,392] Trial 0 finished with value: 0.5263157894736842 and parameters: {'max_depth': 7, 'learning_rate': 0.07482920440979424, 'subsample': 0.10009149985387591, 'gamma': 0.3418660581054718, 'n_estimators': 1880}. Best is trial 0 with value: 0.5263157894736842.
[I 2021-06-29 14:09:52,065] Trial 1 finished with value: 0.5714285714285715 and parameters: {'max_depth': 3, 'learning_rate': 0.026763419023990383, 'subsample': 0.3764485816344382, 'gamma': 0.41741397938453595, 'n_estimators': 4233}. Best is trial 1 with value: 0.5714285714285715.
[I 2021-06-29 14:09:52,560] Trial 2 finished with value: 0.35294117647058826 and parameters: {'max_depth': 7, 'learning_rate': 0.07166975503570835, 'subsample': 0.263561799785214, 'gamma': 0.8024939491127564, 'n_estimators': 1164}. Best is trial 1 with value: 0.5714285714285715.
[I 2021-06-29 14:09:53,451] Trial 3 finished with value: 0.5555555555555556 and parameters: {'max_depth': 9, 'learning_rate': 0.047557432213041435, 'subsample': 0.5469518627566013, 'gamma': 0.21230955087618703, 'n_estimators': 2188}. Best is trial 1 with value: 0.5714285714285715.
[I 2021-06-29 14:09:55,533] Trial 4 finished with value: 0.5263157894736842 and parameters: {'max_depth': 11, 'learning_rate': 0.09714354181474578, 'subsample': 0.35073934252739425, 'gamma': 0.6538580925354512, 'n_estimators': 6259}. Best is trial 1 with value: 0.5714285714285715.
[I 2021-06-29 14:09:57,828] Trial 5 finished with value: 0.5714285714285715 and parameters: {'max_depth': 11, 'learning_rate': 0.017653979023280014, 'subsample': 0.1312438265863059, 'gamma': 0.23586433565165513, 'n_estimators': 6269}. Best is trial 1 with value: 0.5714285714285715.
[I 2021-06-29 14:10:00,057] Trial 6 finished with value: 0.5714285714285715 and parameters: {'max_depth': 3, 'learning_rate': 0.0478996862504547, 'subsample': 0.8663116241204015, 'gamma': 0.5265322279784137, 'n_estimators': 5151}. Best is trial 1 with value: 0.5714285714285715.
[I 2021-06-29 14:10:02,264] Trial 7 finished with value: 0.6666666666666666 and parameters: {'max_depth': 6, 'learning_rate': 0.07178508349134254, 'subsample': 0.7677005375178984, 'gamma': 0.11463062187535344, 'n_estimators': 5501}. Best is trial 7 with value: 0.6666666666666666.
[I 2021-06-29 14:10:03,813] Trial 8 finished with value: 0.6 and parameters: {'max_depth': 12, 'learning_rate': 0.07733490889418555, 'subsample': 0.32435519365152415, 'gamma': 0.7314234627611909, 'n_estimators': 1619}. Best is trial 7 with value: 0.6666666666666666.
[I 2021-06-29 14:10:05,271] Trial 9 finished with value: 0.6 and parameters: {'max_depth': 7, 'learning_rate': 0.09177359527837861, 'subsample': 0.3348913186989436, 'gamma': 0.330220270869079, 'n_estimators': 1780}. Best is trial 7 with value: 0.6666666666666666.
[I 2021-06-29 14:10:07,531] Trial 10 finished with value: 0.4761904761904762 and parameters: {'max_depth': 3, 'learning_rate': 0.0710951979645902, 'subsample': 0.26930249280004726, 'gamma': 0.31243732749778097, 'n_estimators': 3949}. Best is trial 7 with value: 0.6666666666666666.
[I 2021-06-29 14:10:13,140] Trial 11 finished with value: 0.5714285714285715 and parameters: {'max_depth': 3, 'learning_rate': 0.061670584494281186, 'subsample': 0.21738285992464812, 'gamma': 0.5714444295226274, 'n_estimators': 5199}. Best is trial 7 with value: 0.6666666666666666.
[I 2021-06-29 14:10:14,473] Trial 12 finished with value: 0.631578947368421 and parameters: {'max_depth': 4, 'learning_rate': 0.04726503890376115, 'subsample': 0.6555201261821961, 'gamma': 0.4313434156215221, 'n_estimators': 1299}. Best is trial 7 with value: 0.6666666666666666.
[I 2021-06-29 14:10:20,305] Trial 13 finished with value: 0.5714285714285715 and parameters: {'max_depth': 8, 'learning_rate': 0.069741518069781, 'subsample': 0.5119112896466469, 'gamma': 0.8556758047926507, 'n_estimators': 4519}. Best is trial 7 with value: 0.6666666666666666.
[I 2021-06-29 14:10:24,940] Trial 14 finished with value: 0.5263157894736842 and parameters: {'max_depth': 12, 'learning_rate': 0.02237272337316138, 'subsample': 0.21142107780060684, 'gamma': 0.7459130309676191, 'n_estimators': 3386}. Best is trial 7 with value: 0.6666666666666666.
[I 2021-06-29 14:10:28,470] Trial 15 finished with value: 0.5 and parameters: {'max_depth': 4, 'learning_rate': 0.09347577223564306, 'subsample': 0.37821268779640527, 'gamma': 0.7006496825089245, 'n_estimators': 5356}. Best is trial 7 with value: 0.6666666666666666.
[I 2021-06-29 14:10:29,691] Trial 16 finished with value: 0.6363636363636364 and parameters: {'max_depth': 11, 'learning_rate': 0.06613049863500481, 'subsample': 0.7007539472218698, 'gamma': 0.379118673582274, 'n_estimators': 2619}. Best is trial 7 with value: 0.6666666666666666.
[I 2021-06-29 14:10:37,015] Trial 17 finished with value: 0.6666666666666666 and parameters: {'max_depth': 11, 'learning_rate': 0.04852820708841655, 'subsample': 0.8718720377187085, 'gamma': 0.6307531982547585, 'n_estimators': 4730}. Best is trial 7 with value: 0.6666666666666666.
[I 2021-06-29 14:10:38,736] Trial 18 finished with value: 0.5714285714285715 and parameters: {'max_depth': 4, 'learning_rate': 0.09545403328363641, 'subsample': 0.4599297067839524, 'gamma': 0.5627116915097055, 'n_estimators': 3449}. Best is trial 7 with value: 0.6666666666666666.
[I 2021-06-29 14:10:40,728] Trial 19 finished with value: 0.5263157894736842 and parameters: {'max_depth': 5, 'learning_rate': 0.09130415685060285, 'subsample': 0.5589435893378287, 'gamma': 0.10229626162492718, 'n_estimators': 4703}. Best is trial 7 with value: 0.6666666666666666.
[I 2021-06-29 14:10:48,971] Trial 20 finished with value: 0.7000000000000001 and parameters: {'max_depth': 6, 'learning_rate': 0.05743522920318484, 'subsample': 0.8087536794486196, 'gamma': 0.3858158080019999, 'n_estimators': 6452}. Best is trial 20 with value: 0.7000000000000001.
[I 2021-06-29 14:11:00,410] Trial 21 finished with value: 0.6666666666666666 and parameters: {'max_depth': 9, 'learning_rate': 0.011423911856190065, 'subsample': 0.843549786995009, 'gamma': 0.6527175340135392, 'n_estimators': 6984}. Best is trial 20 with value: 0.7000000000000001.
[I 2021-06-29 14:11:01,540] Trial 22 finished with value: 0.7000000000000001 and parameters: {'max_depth': 4, 'learning_rate': 0.022342217466599, 'subsample': 0.8460763704297308, 'gamma': 0.6574545291919202, 'n_estimators': 1396}. Best is trial 20 with value: 0.7000000000000001.
[I 2021-06-29 14:11:03,776] Trial 23 finished with value: 0.631578947368421 and parameters: {'max_depth': 10, 'learning_rate': 0.07784885696151218, 'subsample': 0.8384196284371866, 'gamma': 0.6692198069027774, 'n_estimators': 1745}. Best is trial 20 with value: 0.7000000000000001.
[I 2021-06-29 14:11:08,158] Trial 24 finished with value: 0.5263157894736842 and parameters: {'max_depth': 3, 'learning_rate': 0.012358988818994734, 'subsample': 0.12264519041663569, 'gamma': 0.29696885408243673, 'n_estimators': 6161}. Best is trial 20 with value: 0.7000000000000001.
[I 2021-06-29 14:11:12,161] Trial 25 finished with value: 0.631578947368421 and parameters: {'max_depth': 8, 'learning_rate': 0.059753978081718936, 'subsample': 0.7736247138876846, 'gamma': 0.19933865209592894, 'n_estimators': 2675}. Best is trial 20 with value: 0.7000000000000001.
[I 2021-06-29 14:11:16,257] Trial 26 finished with value: 0.6 and parameters: {'max_depth': 8, 'learning_rate': 0.09726361734877072, 'subsample': 0.548824175404568, 'gamma': 0.11491783149835443, 'n_estimators': 5804}. Best is trial 20 with value: 0.7000000000000001.
[I 2021-06-29 14:11:22,912] Trial 27 finished with value: 0.5 and parameters: {'max_depth': 5, 'learning_rate': 0.08263946760569013, 'subsample': 0.41028851525133747, 'gamma': 0.7908334836475429, 'n_estimators': 5483}. Best is trial 20 with value: 0.7000000000000001.
[I 2021-06-29 14:11:23,890] Trial 28 finished with value: 0.5263157894736842 and parameters: {'max_depth': 8, 'learning_rate': 0.022280970309461655, 'subsample': 0.14793415160976933, 'gamma': 0.19707476459258988, 'n_estimators': 1267}. Best is trial 20 with value: 0.7000000000000001.
[I 2021-06-29 14:11:25,306] Trial 29 finished with value: 0.631578947368421 and parameters: {'max_depth': 4, 'learning_rate': 0.030313840474706928, 'subsample': 0.6703911843061413, 'gamma': 0.547773585643314, 'n_estimators': 1075}. Best is trial 20 with value: 0.7000000000000001.
[I 2021-06-29 14:11:27,378] Trial 30 finished with value: 0.5263157894736842 and parameters: {'max_depth': 3, 'learning_rate': 0.09705486970002448, 'subsample': 0.5544803695359537, 'gamma': 0.2626345877287924, 'n_estimators': 2514}. Best is trial 20 with value: 0.7000000000000001.
[I 2021-06-29 14:11:33,045] Trial 31 finished with value: 0.6666666666666666 and parameters: {'max_depth': 10, 'learning_rate': 0.027588653299838693, 'subsample': 0.5650871418186062, 'gamma': 0.8760159912706499, 'n_estimators': 6081}. Best is trial 20 with value: 0.7000000000000001.
[I 2021-06-29 14:11:34,744] Trial 32 finished with value: 0.6 and parameters: {'max_depth': 5, 'learning_rate': 0.054439274284185706, 'subsample': 0.5959645747051038, 'gamma': 0.763184719640143, 'n_estimators': 1940}. Best is trial 20 with value: 0.7000000000000001.
[I 2021-06-29 14:11:37,858] Trial 33 finished with value: 0.6 and parameters: {'max_depth': 3, 'learning_rate': 0.01630199293473001, 'subsample': 0.4890760887496255, 'gamma': 0.5850635693226643, 'n_estimators': 4413}. Best is trial 20 with value: 0.7000000000000001.
[I 2021-06-29 14:11:40,838] Trial 34 finished with value: 0.631578947368421 and parameters: {'max_depth': 6, 'learning_rate': 0.09897545389712041, 'subsample': 0.5637961753966375, 'gamma': 0.4041129380988403, 'n_estimators': 4306}. Best is trial 20 with value: 0.7000000000000001.
[I 2021-06-29 14:11:42,653] Trial 35 finished with value: 0.4444444444444444 and parameters: {'max_depth': 10, 'learning_rate': 0.07023096041078662, 'subsample': 0.3119356461302475, 'gamma': 0.15306786754275326, 'n_estimators': 3220}. Best is trial 20 with value: 0.7000000000000001.
[I 2021-06-29 14:11:44,591] Trial 36 finished with value: 0.5714285714285715 and parameters: {'max_depth': 9, 'learning_rate': 0.028915660892335562, 'subsample': 0.7022044429910511, 'gamma': 0.15322918508329197, 'n_estimators': 2562}. Best is trial 20 with value: 0.7000000000000001.
[I 2021-06-29 14:11:49,937] Trial 37 finished with value: 0.5714285714285715 and parameters: {'max_depth': 11, 'learning_rate': 0.027409085436099496, 'subsample': 0.6115687047039521, 'gamma': 0.5197362472989869, 'n_estimators': 6549}. Best is trial 20 with value: 0.7000000000000001.
[I 2021-06-29 14:11:55,395] Trial 38 finished with value: 0.631578947368421 and parameters: {'max_depth': 5, 'learning_rate': 0.015936498161562142, 'subsample': 0.6880527706309356, 'gamma': 0.7177424236345974, 'n_estimators': 6447}. Best is trial 20 with value: 0.7000000000000001.
[I 2021-06-29 14:11:59,326] Trial 39 finished with value: 0.6 and parameters: {'max_depth': 12, 'learning_rate': 0.011255641567803731, 'subsample': 0.28748966889713645, 'gamma': 0.5934226856013262, 'n_estimators': 6695}. Best is trial 20 with value: 0.7000000000000001.
[I 2021-06-29 14:12:01,984] Trial 40 finished with value: 0.631578947368421 and parameters: {'max_depth': 12, 'learning_rate': 0.06009878693756408, 'subsample': 0.8324850798130197, 'gamma': 0.61325296715707, 'n_estimators': 3340}. Best is trial 20 with value: 0.7000000000000001.
