[I 2021-07-01 18:34:26,871] Trial 12 finished with value: 0.3636363636363636 and parameters: {'C': 3.2484197638745114e-05, 'gamma': 0.0011756551187580215, 'kernel': 'linear'}. Best is trial 3 with value: 0.6666666666666666.
[I 2021-07-01 18:34:26,885] Trial 13 finished with value: 0.0 and parameters: {'C': 0.004780595843863193, 'gamma': 0.020843623798933626, 'kernel': 'rbf'}. Best is trial 3 with value: 0.6666666666666666.
[I 2021-07-01 18:34:26,901] Trial 14 finished with value: 0.3636363636363636 and parameters: {'C': 0.32885888232073535, 'gamma': 4.8682572661358864e-05, 'kernel': 'rbf'}. Best is trial 3 with value: 0.6666666666666666.
[I 2021-07-01 18:34:26,914] Trial 15 finished with value: 0.0 and parameters: {'C': 6.710748849223313e-05, 'gamma': 0.434053139666011, 'kernel': 'rbf'}. Best is trial 3 with value: 0.6666666666666666.
[I 2021-07-01 18:34:30,504] Trial 16 finished with value: 0.5882352941176471 and parameters: {'C': 0.26093387032549575, 'gamma': 0.013132912033012485, 'kernel': 'linear'}. Best is trial 3 with value: 0.6666666666666666.
[I 2021-07-01 18:34:35,231] Trial 17 finished with value: 0.5882352941176471 and parameters: {'C': 0.30159982901199417, 'gamma': 0.001381834238855257, 'kernel': 'linear'}. Best is trial 3 with value: 0.6666666666666666.
[I 2021-07-01 18:34:35,245] Trial 18 finished with value: 0.0 and parameters: {'C': 3.7473983805068124e-05, 'gamma': 0.5590443897952936, 'kernel': 'rbf'}. Best is trial 3 with value: 0.6666666666666666.
[I 2021-07-01 18:34:35,255] Trial 19 finished with value: 0.0 and parameters: {'C': 0.0001531563124279051, 'gamma': 0.32877410395706247, 'kernel': 'sigmoid'}. Best is trial 3 with value: 0.6666666666666666.
[I 2021-07-01 18:34:35,266] Trial 20 finished with value: 0.0 and parameters: {'C': 0.0004297585333493071, 'gamma': 0.004318078281385298, 'kernel': 'sigmoid'}. Best is trial 3 with value: 0.6666666666666666.
[I 2021-07-01 18:34:35,280] Trial 21 finished with value: 0.0 and parameters: {'C': 0.013085809057162754, 'gamma': 1.1997926973420284e-05, 'kernel': 'sigmoid'}. Best is trial 3 with value: 0.6666666666666666.
[I 2021-07-01 18:34:35,292] Trial 22 finished with value: 0.3636363636363636 and parameters: {'C': 7.272815020888165e-05, 'gamma': 4.8492966026987945e-05, 'kernel': 'linear'}. Best is trial 3 with value: 0.6666666666666666.
[I 2021-07-01 18:34:36,110] Trial 23 finished with value: 0.5882352941176471 and parameters: {'C': 0.0598846151660647, 'gamma': 0.0588004896106758, 'kernel': 'linear'}. Best is trial 3 with value: 0.6666666666666666.
[I 2021-07-01 18:34:36,124] Trial 24 finished with value: 0.0 and parameters: {'C': 1.2571892801400742e-05, 'gamma': 1.3522435991628912e-05, 'kernel': 'sigmoid'}. Best is trial 3 with value: 0.6666666666666666.
[I 2021-07-01 18:34:36,197] Trial 25 finished with value: 0.5333333333333333 and parameters: {'C': 0.0049448750459448135, 'gamma': 0.005809113921463084, 'kernel': 'linear'}. Best is trial 3 with value: 0.6666666666666666.
[I 2021-07-01 18:34:36,208] Trial 26 finished with value: 0.0 and parameters: {'C': 0.008487823836908569, 'gamma': 0.7046585755939448, 'kernel': 'sigmoid'}. Best is trial 3 with value: 0.6666666666666666.
[I 2021-07-01 18:34:36,222] Trial 27 finished with value: 0.0 and parameters: {'C': 0.00014617441660497824, 'gamma': 0.10852404632723824, 'kernel': 'rbf'}. Best is trial 3 with value: 0.6666666666666666.
[I 2021-07-01 18:34:36,238] Trial 28 finished with value: 0.0 and parameters: {'C': 0.00604228449787321, 'gamma': 4.8114516760523194e-05, 'kernel': 'rbf'}. Best is trial 3 with value: 0.6666666666666666.
[I 2021-07-01 18:34:36,251] Trial 29 finished with value: 0.3636363636363636 and parameters: {'C': 3.4472330553621894e-05, 'gamma': 0.0001344456307712471, 'kernel': 'linear'}. Best is trial 3 with value: 0.6666666666666666.
[I 2021-07-01 18:34:36,261] Trial 30 finished with value: 0.3636363636363636 and parameters: {'C': 2.2901893905880608e-05, 'gamma': 0.6860908856598674, 'kernel': 'linear'}. Best is trial 3 with value: 0.6666666666666666.
[I 2021-07-01 18:34:36,276] Trial 31 finished with value: 0.0 and parameters: {'C': 0.052375631261556074, 'gamma': 9.487404242649025e-05, 'kernel': 'rbf'}. Best is trial 3 with value: 0.6666666666666666.
[I 2021-07-01 18:34:36,291] Trial 32 finished with value: 0.0 and parameters: {'C': 0.00015821177236368037, 'gamma': 0.002943395159581409, 'kernel': 'rbf'}. Best is trial 3 with value: 0.6666666666666666.
[I 2021-07-01 18:34:36,304] Trial 33 finished with value: 0.0 and parameters: {'C': 1.2384572243648861e-05, 'gamma': 2.239291948629667e-05, 'kernel': 'rbf'}. Best is trial 3 with value: 0.6666666666666666.
[I 2021-07-01 18:34:36,319] Trial 34 finished with value: 0.5 and parameters: {'C': 0.00038619980184432227, 'gamma': 0.877163944912375, 'kernel': 'linear'}. Best is trial 3 with value: 0.6666666666666666.
[I 2021-07-01 18:34:36,329] Trial 35 finished with value: 0.0 and parameters: {'C': 0.05329324371211276, 'gamma': 0.02219036609586521, 'kernel': 'sigmoid'}. Best is trial 3 with value: 0.6666666666666666.
[I 2021-07-01 18:34:36,506] Trial 36 finished with value: 0.7058823529411765 and parameters: {'C': 0.014079509821895432, 'gamma': 0.00011242685178549635, 'kernel': 'linear'}. Best is trial 36 with value: 0.7058823529411765.
[I 2021-07-01 18:34:36,520] Trial 37 finished with value: 0.0 and parameters: {'C': 0.10562648280651515, 'gamma': 9.271957090905028e-05, 'kernel': 'sigmoid'}. Best is trial 36 with value: 0.7058823529411765.
[I 2021-07-01 18:34:36,535] Trial 38 finished with value: 0.0 and parameters: {'C': 0.00020724490021311042, 'gamma': 2.1370045823661018e-05, 'kernel': 'sigmoid'}. Best is trial 36 with value: 0.7058823529411765.
[I 2021-07-01 18:34:36,549] Trial 39 finished with value: 0.5 and parameters: {'C': 0.45694122956451827, 'gamma': 1.1742426889804171e-05, 'kernel': 'sigmoid'}. Best is trial 36 with value: 0.7058823529411765.
[I 2021-07-01 18:34:43,141] Trial 40 finished with value: 0.6666666666666666 and parameters: {'C': 0.563482712095549, 'gamma': 0.006071079794060205, 'kernel': 'linear'}. Best is trial 36 with value: 0.7058823529411765.
[I 2021-07-01 18:34:43,158] Trial 41 finished with value: 0.0 and parameters: {'C': 0.0026912456166929837, 'gamma': 0.010508782767409216, 'kernel': 'rbf'}. Best is trial 36 with value: 0.7058823529411765.
[I 2021-07-01 18:34:43,180] Trial 42 finished with value: 0.5714285714285714 and parameters: {'C': 0.0009427098928543664, 'gamma': 0.6551076066793498, 'kernel': 'linear'}. Best is trial 36 with value: 0.7058823529411765.
[I 2021-07-01 18:34:43,222] Trial 43 finished with value: 0.6250000000000001 and parameters: {'C': 0.0033752879456183825, 'gamma': 1.2812209350007838e-05, 'kernel': 'linear'}. Best is trial 36 with value: 0.7058823529411765.
[I 2021-07-01 18:34:43,237] Trial 44 finished with value: 0.0 and parameters: {'C': 7.602935005242788e-05, 'gamma': 0.00045742286724279936, 'kernel': 'rbf'}. Best is trial 36 with value: 0.7058823529411765.
[I 2021-07-01 18:34:43,246] Trial 45 finished with value: 0.0 and parameters: {'C': 0.5018078046787631, 'gamma': 0.008129632237513727, 'kernel': 'sigmoid'}. Best is trial 36 with value: 0.7058823529411765.
[I 2021-07-01 18:34:43,283] Trial 46 finished with value: 0.6666666666666666 and parameters: {'C': 0.0019925137592348777, 'gamma': 0.00539180379552831, 'kernel': 'linear'}. Best is trial 36 with value: 0.7058823529411765.
[I 2021-07-01 18:34:43,298] Trial 47 finished with value: 0.0 and parameters: {'C': 0.009898093187184744, 'gamma': 1.1958215558990708e-05, 'kernel': 'sigmoid'}. Best is trial 36 with value: 0.7058823529411765.
[I 2021-07-01 18:34:43,308] Trial 48 finished with value: 0.0 and parameters: {'C': 0.0003768981584625056, 'gamma': 0.2913691336370612, 'kernel': 'sigmoid'}. Best is trial 36 with value: 0.7058823529411765.
[I 2021-07-01 18:34:43,322] Trial 49 finished with value: 0.0 and parameters: {'C': 0.011485658125746624, 'gamma': 1.860143120473331e-05, 'kernel': 'sigmoid'}. Best is trial 36 with value: 0.7058823529411765.
svm_best_param_v1: {'C': 0.014079509821895432, 'gamma': 0.00011242685178549635, 'kernel': 'linear'}
